[
{"season":2025,"team":"ARI","games":17,"off_plays":1163,"off_epa_per_play":-0.1006,"off_pass_epa":-0.1305,"off_run_epa":-0.0655,"off_success_rate":0.4033,"off_explosive_rate":0.0774,"off_pass_rate":0.5408,"off_proe":-0.0397,"off_early_down_pass_rate":0.5163,"off_third_down_conv_rate":0.3825,"off_red_zone_td_rate":0.4727,"def_plays":1137,"def_epa_per_play":-0.0751,"def_pass_epa":-0.0126,"def_run_epa":-0.1677,"def_success_rate":0.4292,"def_explosive_rate":0.0756,"def_third_down_conv_rate":0.3982,"def_red_zone_td_rate":0.4762,"def_blitz_rate":0.2916,"def_pressure_rate":0.327,"rank_off_epa_per_play":26,"rank_off_pass_epa":31,"rank_off_run_epa":10,"rank_off_success_rate":26,"rank_off_explosive_rate":28,"rank_off_pass_rate":26,"rank_off_proe":27,"rank_off_early_down_pass_rate":26,"rank_off_third_down_conv_rate":23,"rank_off_red_zone_td_rate":27,"rank_def_epa_per_play":8,"rank_def_pass_epa":7,"rank_def_run_epa":9,"rank_def_success_rate":7,"rank_def_explosive_rate":3,"rank_def_third_down_conv_rate":11,"rank_def_red_zone_td_rate":2,"rank_def_blitz_rate":15,"rank_def_pressure_rate":20},
{"season":2025,"team":"ATL","games":17,"off_plays":1156,"off_epa_per_play":0.0197,"off_pass_epa":0.0961,"off_run_epa":-0.0806,"off_success_rate":0.4593,"off_explosive_rate":0.1064,"off_pass_rate":0.5675,"off_proe":-0.0037,"off_early_down_pass_rate":0.5605,"off_third_down_conv_rate":0.4817,"off_red_zone_td_rate":0.6269,"def_plays":1114,"def_epa_per_play":0.0701,"def_pass_epa":0.1265,"def_run_epa":-0.0032,"def_success_rate":0.5018,"def_explosive_rate":0.1158,"def_third_down_conv_rate":0.4541,"def_red_zone_td_rate":0.6176,"def_blitz_rate":0.2683,"def_pressure_rate":0.2714,"rank_off_epa_per_play":13,"rank_off_pass_epa":15,"rank_off_run_epa":12,"rank_off_success_rate":14,"rank_off_explosive_rate":10,"rank_off_pass_rate":18,"rank_off_proe":20,"rank_off_early_down_pass_rate":14,"rank_off_third_down_conv_rate":8,"rank_off_red_zone_td_rate":8,"rank_def_epa_per_play":28,"rank_def_pass_epa":24,"rank_def_run_epa":30,"rank_def_success_rate":29,"rank_def_explosive_rate":29,"rank_def_third_down_conv_rate":24,"rank_def_red_zone_td_rate":20,"rank_def_blitz_rate":20,"rank_def_pressure_rate":30},
{"season":2025,"team":"BAL","games":17,"off_plays":1171,"off_epa_per_play":0.1088,"off_pass_epa":0.2039,"off_run_epa":0.0047,"off_success_rate":0.4902,"off_explosive_rate":0.1144,"off_pass_rate":0.5226,"off_proe":0.0116,"off_early_down_pass_rate":0.499,"off_third_down_conv_rate":0.4541,"off_red_zone_td_rate":0.6522,"def_plays":1113,"def_epa_per_play":-0.1353,"def_pass_epa":-0.0907,"def_run_epa":-0.2187,"def_success_rate":0.3953,"def_explosive_rate":0.0827,"def_third_down_conv_rate":0.317,"def_red_zone_td_rate":0.5,"def_blitz_rate":0.451,"def_pressure_rate":0.4593,"rank_off_epa_per_play":5,"rank_off_pass_epa":5,"rank_off_run_epa":4,"rank_off_success_rate":8,"rank_off_explosive_rate":6,"rank_off_pass_rate":29,"rank_off_proe":14,"rank_off_early_down_pass_rate":29,"rank_off_third_down_conv_rate":9,"rank_off_red_zone_td_rate":5,"rank_def_epa_per_play":2,"rank_def_pass_epa":1,"rank_def_run_epa":3,"rank_def_success_rate":2,"rank_def_explosive_rate":5,"rank_def_third_down_conv_rate":2,"rank_def_red_zone_td_rate":4,"rank_def_blitz_rate":1,"rank_def_pressure_rate":1},
{"season":2025,"team":"BUF","games":17,"off_plays":1157,"off_epa_per_play":0.0109,"off_pass_epa":0.1086,"off_run_epa":-0.1014,"off_success_rate":0.4572,"off_explosive_rate":0.1037,"off_pass_rate":0.535,"off_proe":-0.0276,"off_early_down_pass_rate":0.5049,"off_third_down_conv_rate":0.4465,"off_red_zone_td_rate":0.6716,"def_plays":1079,"def_epa_per_play":0.0094,"def_pass_epa":0.1057,"def_run_epa":-0.13,"def_success_rate":0.4671,"def_explosive_rate":0.1038,"def_third_down_conv_rate":0.4328,"def_red_zone_td_rate":0.5455,"def_blitz_rate":0.2288,"def_pressure_rate":0.2837,"rank_off_epa_per_play":15,"rank_off_pass_epa":14,"rank_off_run_epa":14,"rank_off_success_rate":15,"rank_off_explosive_rate":11,"rank_off_pass_rate":27,"rank_off_proe":24,"rank_off_early_down_pass_rate":28,"rank_off_third_down_conv_rate":11,"rank_off_red_zone_td_rate":4,"rank_def_epa_per_play":21,"rank_def_pass_epa":22,"rank_def_run_epa":16,"rank_def_success_rate":23,"rank_def_explosive_rate":24,"rank_def_third_down_conv_rate":17,"rank_def_red_zone_td_rate":11,"rank_def_blitz_rate":27,"rank_def_pressure_rate":27},
{"season":2025,"team":"CAR","games":17,"off_plays":1106,"off_epa_per_play":0.2957,"off_pass_epa":0.5003,"off_run_epa":0.0925,"off_success_rate":0.5841,"off_explosive_rate":0.1582,"off_pass_rate":0.4982,"off_proe":0.0018,"off_early_down_pass_rate":0.483,"off_third_down_conv_rate":0.609,"off_red_zone_td_rate":0.837,"def_plays":1118,"def_epa_per_play":0.019,"def_pass_epa":0.0516,"def_run_epa":-0.0358,"def_success_rate":0.4553,"def_explosive_rate":0.102,"def_third_down_conv_rate":0.4433,"def_red_zone_td_rate":0.5738,"def_blitz_rate":0.3352,"def_pressure_rate":0.3252,"rank_off_epa_per_play":1,"rank_off_pass_epa":1,"rank_off_run_epa":1,"rank_off_success_rate":1,"rank_off_explosive_rate":1,"rank_off_pass_rate":30,"rank_off_proe":18,"rank_off_early_down_pass_rate":30,"rank_off_third_down_conv_rate":1,"rank_off_red_zone_td_rate":1,"rank_def_epa_per_play":22,"rank_def_pass_epa":17,"rank_def_run_epa":27,"rank_def_success_rate":18,"rank_def_explosive_rate":22,"rank_def_third_down_conv_rate":19,"rank_def_red_zone_td_rate":18,"rank_def_blitz_rate":3,"rank_def_pressure_rate":21},
{"season":2025,"team":"CHI","games":17,"off_plays":1135,"off_epa_per_play":-0.1332,"off_pass_epa":-0.1082,"off_run_epa":-0.1753,"off_success_rate":0.4115,"off_explosive_rate":0.0731,"off_pass_rate":0.6273,"off_proe":0.0015,"off_early_down_pass_rate":0.6016,"off_third_down_conv_rate":0.3875,"off_red_zone_td_rate":0.5556,"def_plays":1155,"def_epa_per_play":0.0689,"def_pass_epa":0.2237,"def_run_epa":-0.1131,"def_success_rate":0.4823,"def_explosive_rate":0.0944,"def_third_down_conv_rate":0.446,"def_red_zone_td_rate":0.6351,"def_blitz_rate":0.2163,"def_pressure_rate":0.25,"rank_off_epa_per_play":29,"rank_off_pass_epa":28,"rank_off_run_epa":23,"rank_off_success_rate":23,"rank_off_explosive_rate":31,"rank_off_pass_rate":6,"rank_off_proe":19,"rank_off_early_down_pass_rate":6,"rank_off_third_down_conv_rate":22,"rank_off_red_zone_td_rate":19,"rank_def_epa_per_play":27,"rank_def_pass_epa":27,"rank_def_run_epa":18,"rank_def_success_rate":28,"rank_def_explosive_rate":11,"rank_def_third_down_conv_rate":21,"rank_def_red_zone_td_rate":23,"rank_def_blitz_rate":29,"rank_def_pressure_rate":32},
{"season":2025,"team":"CIN","games":17,"off_plays":1173,"off_epa_per_play":0.0849,"off_pass_epa":0.1882,"off_run_epa":-0.0375,"off_success_rate":0.4953,"off_explosive_rate":0.1134,"off_pass_rate":0.5422,"off_proe":-0.0042,"off_early_down_pass_rate":0.5265,"off_third_down_conv_rate":0.4873,"off_red_zone_td_rate":0.6364,"def_plays":1097,"def_epa_per_play":-0.042,"def_pass_epa":0.0336,"def_run_epa":-0.1626,"def_success_rate":0.4266,"def_explosive_rate":0.0966,"def_third_down_conv_rate":0.3775,"def_red_zone_td_rate":0.6102,"def_blitz_rate":0.2092,"def_pressure_rate":0.316,"rank_off_epa_per_play":8,"rank_off_pass_epa":8,"rank_off_run_epa":7,"rank_off_success_rate":5,"rank_off_explosive_rate":8,"rank_off_pass_rate":25,"rank_off_proe":21,"rank_off_early_down_pass_rate":23,"rank_off_third_down_conv_rate":7,"rank_off_red_zone_td_rate":7,"rank_def_epa_per_play":10,"rank_def_pass_epa":13,"rank_def_run_epa":10,"rank_def_success_rate":5,"rank_def_explosive_rate":18,"rank_def_third_down_conv_rate":6,"rank_def_red_zone_td_rate":19,"rank_def_blitz_rate":32,"rank_def_pressure_rate":25},
{"season":2025,"team":"CLE","games":17,"off_plays":1120,"off_epa_per_play":-0.0231,"off_pass_epa":0.049,"off_run_epa":-0.1157,"off_success_rate":0.4554,"off_explosive_rate":0.0955,"off_pass_rate":0.5625,"off_proe":-0.0334,"off_early_down_pass_rate":0.534,"off_third_down_conv_rate":0.4159,"off_red_zone_td_rate":0.5694,"def_plays":1128,"def_epa_per_play":0.0074,"def_pass_epa":0.0304,"def_run_epa":-0.0234,"def_success_rate":0.4725,"def_explosive_rate":0.1046,"def_third_down_conv_rate":0.4633,"def_red_zone_td_rate":0.5139,"def_blitz_rate":0.2419,"def_pressure_rate":0.3705,"rank_off_epa_per_play":17,"rank_off_pass_epa":17,"rank_off_run_epa":17,"rank_off_success_rate":17,"rank_off_explosive_rate":16,"rank_off_pass_rate":19,"rank_off_proe":26,"rank_off_early_down_pass_rate":20,"rank_off_third_down_conv_rate":16,"rank_off_red_zone_td_rate":17,"rank_def_epa_per_play":19,"rank_def_pass_epa":12,"rank_def_run_epa":28,"rank_def_success_rate":27,"rank_def_explosive_rate":25,"rank_def_third_down_conv_rate":26,"rank_def_red_zone_td_rate":6,"rank_def_blitz_rate":25,"rank_def_pressure_rate":7},
{"season":2025,"team":"DAL","games":17,"off_plays":1115,"off_epa_per_play":-0.0681,"off_pass_epa":-0.0,"off_run_epa":-0.1707,"off_success_rate":0.4215,"off_explosive_rate":0.0942,"off_pass_rate":0.6009,"off_proe":0.0124,"off_early_down_pass_rate":0.5769,"off_third_down_conv_rate":0.3738,"off_red_zone_td_rate":0.541,"def_plays":1151,"def_epa_per_play":-0.0263,"def_pass_epa":0.0349,"def_run_epa":-0.1057,"def_success_rate":0.4648,"def_explosive_rate":0.0956,"def_third_down_conv_rate":0.3944,"def_red_zone_td_rate":0.5362,"def_blitz_rate":0.3338,"def_pressure_rate":0.3462,"rank_off_epa_per_play":22,"rank_off_pass_epa":25,"rank_off_run_epa":22,"rank_off_success_rate":21,"rank_off_explosive_rate":19,"rank_off_pass_rate":11,"rank_off_proe":13,"rank_off_early_down_pass_rate":13,"rank_off_third_down_conv_rate":26,"rank_off_red_zone_td_rate":22,"rank_def_epa_per_play":14,"rank_def_pass_epa":14,"rank_def_run_epa":20,"rank_def_success_rate":21,"rank_def_explosive_rate":15,"rank_def_third_down_conv_rate":7,"rank_def_red_zone_td_rate":9,"rank_def_blitz_rate":6,"rank_def_pressure_rate":12},